group name;country;country_code (iso 3661-alpha2);description;Topics (separated by |||);Links (separated by |||) (Format: text>>>url>>>type) (type SLACK, TELEGRAM, FACEBOOK, TWITTER, INSTAGRAM, TRELLO, WEBSITE)
Code for Australia;Australia;AU;Help for Australia;Software|||Digital|||Foo;Tretet bei>>>https://foo.slack.com>>>SLACK|||Folgt uns>>>https://twitter.com/codeforaustralia>>>TWITTER|||Besucht uns>>>https://www.codeforaustralia.com>>>WEBSITE
BreathOfLife;Belgium;BE;Breathing Device, Syringe pump;Breathing Device|||syringe pump;breathoflifegroupe.slack.com>>>https://join.slack.com/t/breathoflifegroupe/shared_invite/zt-csnedr51-pa1k0h5aEN6Gvuk2BKRZjw>>>SLACK
Fablabs of Belgium;Belgium;BE;Fablabs of Belgium. Centralization and pooling of information, initiatives and possible demands from medical world (related to the support that could bring the Fablabs and makers community to the Covid-19 epidemy fight.;Pooling of Information|||initiatives|||medical;MakeInBelgium>>>https://makeinbelgium.slack.com/join/shared_invite/zt-784dho2p-lHZSCmJoFT0nPHuHl7rp3g>>>SLACK|||Coronadenktank>>>https://www.coronadenktank.be/>>>WEBSITE|||Coronadenktank>>>https://twitter.com/coronadenktank>>>TWITTER
MitigateCorona;Belgium;BE;"This Slack is an addition to the ""Make in Belgium"" Slack, which is very hectic at the moment. This place brings together Belgian academics and researchers: engineers, biomedical and other researchers. We are specifically looking for engineers and others who can help with alternative production of ventilators in the #technical-help channel and for Dutch-speaking researchers from life sciences in the #sci-comm channel. All other fields of expertise welcome, too! We are also open for people from the arts: feel free to create a dedicated channel.";Academics|||researchers|||engineers|||biomedical;MitigateCorona>>> https://join.slack.com/t/mitigatecorona/shared_invite/zt-ctipi686-_cvH5JGRAx6SkUGkfAJ1Cw>>>SLACK
ImaGuru;Belarus;BY;All the innovator communities around the world are joining forces to combat the challenging time. Sam Altman from YC announced his intention to invest into COVID 19 startups, European commission secured 164M Euro to fund innovators to resist the virus, our colleagues from some European countries organize events and hackathons online.This is our turn to raise the Imaguru community's voice, fight the crisis, and help stop the virus from spreading in Europe and globally with new ideas, tools, and solutions.We call on all Imaguru friends, hackers, developers, startups and corporations to join us at Imaguru online hackathon #hackathome this Friday, March 20.;ideas|||tools|||hacker|||startup|||corporation;ImaGuru>>>imaguruhackathome.slack.com>>>SLACK|||ImaGuru>>>http://hackathome.imaguru.by/en>>>WEBSITE
CODVID-19;Canada;CA;With the COVID-19 pandemic in full swing, many people are looking at a lot of free time stuck indoors. Avoid cabin fever and use that time to make a difference in your community and the fight against COVID-19 by joining CODEVID-19, the world’s first pandemic hackathon! The purpose of the hackathon ultimately isn’t to win prizes, it’s to build useful apps that people can use to manage and survive during the COVID-19 pandemic Like the COVID-19 situation the hackathon resources and structure will change as time goes on! The first prize (called the first responder prize) will be awarded March 24th and there will be many more to come!;hackathon|||idea|||apps;CODEVID-19>>>https://codevid19.com/>>>WEBSITE|||CODEVID-19>>>https://twitter.com/devedmonton>>>TWITTER|||
Code Life Ventilator Challenge;Canada;CA;To design a low-cost, simple, easy-to-use and easy-to-build ventilator that can serve the COVID patients, in an emergency timeframe.;ventilator|||medical|||3D-Printer;Code Life Ventilator Challenge>>>https://www.agorize.com/en/challenges/code-life-challenge/>>>WEBSITE
Frena la curva;Colombia;CO;Citizen self-help network against # COVID19 The coronavirus pandemic (COVID-19) faces us with an enormous challenge as a planet, as a country and as a society. In these difficult weeks we must give the best of ourselves and ourselves and we must be more united than ever.;help|||initiative|||idea;Frena la curva>>>https://t.me/joinchat/AktO5Fjj_OSd5nXeUl-v7g>>>TELEGRAM|||Frena la curva>>>https://colombia.frenalacurva.net/e119>>>WEBSITE
Wuhan2020;China;CN;Dear friends and volunteers, we are the core organizers of wuhan2020, a project on GitHub aiming to serve this combat against 2019 Novel Coronavirus (COVID-19). This is an Open Source project constructed and maintained by all of us for a better and more effective collaboration that assists the self-organized rescue. The things we are working on:to create a data service for real-time synchronization among hospitals, factories and procurement.to call on more people to participate in this project with their professional skills and various resources.to proceed with our collaborative tasks and constantly stay motivated by the spirit of Open Source community.The online web entrance of our project: Information Collection Platform for Wuhan COVID-19 Epidemic Prevention (in Chinese ????????????).;collaboration|||open source|||data service;Wuhan 2020>>>https://join.slack.com/t/wuhan2020/shared_invite/enQtOTQxMTU4MzgyNTYwLWIxMTMyNWI4NWE2YTk3NGRjZGJhMjUzNmJhMjg1MDQ3OTEzNDE5NGY4MWFhMjRlYWU4MmE3ZGQyOGU4N2YwMzY>>>SLACK|||Wuhan 2020>>>https://community.wuhan2020.org.cn/en-us/community/index.html>>>WEBSITE
COVID19CZ;Czech Republic;CZ;COVID19CZ is a joint activity of several Czech technology companies and IT enthusiasts aimed at helping to fight COVID-19. The purpose of the activity is to offer modern technologies and assistance with communication where they can facilitate the fight against viral infection, either by accessing information or by data analysis facilitating the detection of outbreaks.At present, intensive negotiations are under way with the state administration about which of the approaches, technologies or applications would help both the hygienists, the Ministry of Health, as well as medical staff and volunteers to manage the infection. More than 500 IT specialist enthusiasts are available who are willing to invest their time in developing the necessary smart application and high-quality solution that also respects the privacy of users.;technology|||smart application|||collaboration;COVID19CZ>>>https://covid19cz.cz/>>>WEBSITE|||COVID19CZ>>>https://www.facebook.com/groups/covid19cz/>>>FACEBOOK
Hack the crisis;Estonia;EE;WE ARE ACCELERATING ESTONIA TO NEW HEIGHTS! Starting this evening, Accelerate Estonia and Garage48 will host an online hackathon so that Estonia can emerge from the crisis stronger than ever. Now is the prime time to design, test and launch moonshot ideas that will either help tackle the crisis or position Estonia well for the aftermath. Accelerate Estonia will sponsor up to 5 ideas with 5K for execution during the state of emergency and the full support of the minister for ICT and Foreign Trade, Mr. Kaimar Karu.;hackathon|||idea|||apps|||programming;Hack the crisis>>>https://join.slack.com/t/hackthecrisis/shared_invite/zt-cleso3f7-HiRf6e72pKGyPqmsOci4Mw>>>SLACK|||Hack the crisis>>>https://www.facebook.com/events/garage48/hack-the-crisis/204692110602347/>>>FACEBOOK
Hack the crisis Finland;Finland;FI;Hack the Crisis is an online hackathon organised by local companies, startups and tech communities, together with the Finnish government.This is a call to action to each and everyone to participate in the fight and it is inspired by our southern neighbors from Estonia, who started the movement with their Hack the Crisis.There is no us and them. We are in urge to Save lives, Save communities, Save businesses. We Finns are at our best under pressure. In this critical moment, our task is to work together as a nation to solve one of the biggest crises of our lifetime.;start up|||tech|||collaboration;Hack the crisis Finland>>>https://hackthecrisisfinland.slack.com/join/shared_invite/zt-cv34hdk4-hI9chEn0cUF~MAQBFqCvhg>>>SLACK|||Hack the crisis Finland>>>https://www.hackthecrisisfinland.com/>>>WEBSITE
Dataagainstcovid-19;France;FR;This Slack is a space for exchange around the collection and analysis of data, their representation and the understanding of data-related issues for healthcare workers and civil society.;exchange|||collaboration|||healthcare|||data;Dataagainstcovid-19>>>https://dataagainstcovid-19.slack.com/join/shared_invite/zt-cgsplso2-LIvWeRHlf1ZFIrh~SPj~IA>>>SLACK
Entraide maker - COVID 19;France;FR;An attempt to make a repository of Maker initiatives and document solutions to support hospital and health care giver's needs during the Pandemic Crisis/with everyone at home.Documenting urgent needs both universal and local that reanimation services and healthcare providers are facing during the pandemic crisis: technical and detailed descriptions of problems and parts, mandatory materials and procedures, safety concerns.3D Parametric Model Designs coordination groups, Medical devices Engineering support groupFiles and tutorials for digital fabrication (included 3D printers) to make items to offer to local hospitals.What solutions to get access to filament for 3D printers and other consumables to make the parts. Crowdfunding/ Donations/Filament and materials factories' support. Strategies, contacts, processes and feedback.Documenting process to organise 3D printing volunteers to actually print and dispatch the parts in their local hospitals.;technology|||collaboration|||3d print|||medical;Entraide maker - COVID 19>>>https://discord.gg/N9PANj2>>>DISCORD|||Entraide maker - COVID 19>>>https://www.facebook.com/groups/1120744844933688/>>>FACEBOOK
Hack la crise;France;FR;En cette période de crise, nous vous invitons à rejoindre Hack La Crise - a hackathon virtuel organisé par des bénévoles via la plateforme slack du vendredi 20 mars à 19h au dimanche 22 mars à 19h.;hackathon|||idea|||collaboration;Hack la crise>>>http://bit.ly/slackhacklacrise>>>SLACK|||Hack la crise>>>https://www.hacklacrise.fr/>>>WEBSITE
Hacking Health Camp 2020;France;FR;Online version of Hacking Health Camp 2020 to act now against Coronavirus. We are a community of health innovators. Let's mobilize to quickly create digital tools that will help healthcare professionalsWe are thousands of people motivated to advance health, each having a skill, a network, useful information in this exceptional situation.Take advantage of the confinement to help solve problems related to coronavirus management, in the form of an online hackathon.Healthcare professionals are already submitting problems to us, we invite you to join a project team and help quickly prototype solutions.;healthcare|||medical|||collaboration;Hacking Health Camp 2020>>>http://bit.ly/2xHdgE9>>>SLACK|||Hacking Health Camp 2020>>>http://hackinghealth.camp/>>>WEBSITE
GSCN;France;FR;GSCN provides logistical and technical IT / cybersecurity support to actors crucial to local life in the event of a crisis.;support|||software|||IT|||cybersecurity;GSCN>>>https://discord.gg/zh28VMw>>>DISCORD
OpenCOVID19 Initiative;France;FR;The goal of this project is to develop an open source methodology to safely test for the presence of SARS-CoV-2 using tools as common as possible.;open source|||medical|||health;OpenCOVID19 Initiative>>>https://join.slack.com/t/jogl-covid-19/shared_invite/zt-cbji2hte-8jdoHpJDKg80ZliPVCIjqw>>>SLACK|||OpenCOVID19 Initiative>>>https://app.jogl.io/project/118>>>WEBSITE
Gegen den Virus;Germany;DE;So that we all get through the Corona Virus well, we have to help each other. People from risk groups need your help. Here we provide digital aids that bridge the gap between the digital help offers and the mostly analogue needy. This project is part of KrisenKultur.de;digital aid|||help|||neighbor;Gegen den Virus>>>https://t.me/gegendenviruschannel>>>TELEGRAM|||Gegen den Virus>>>https://gegen-den-virus.de/>>>WEBSITE
WirvsVirus;Germany;DE;48 hours. Challenges of the federal government and from society. You and theoretically 80 million others. The Covid-19 crisis. Diverse solutions. Be there with your skills when we develop solutions from society for society. Together with the federal government, we are creating the digital participation process in the corona crisis. Everywhere in Germany, individuals are working on solutions. The #WirVsVirus Online Hackathon is the digital space in which we can all develop, test and improve solutions together for emerging challenges.;solution|||collaboration|||software;WirvsVirus>>>https://join.slack.com/t/wirvsvirus/invite/enQtMTAxNTcxMzk1NzUyMC03YWZlMDI0YjU4MGRiNzdhZTQ5MmFlZmQxYjAxNTI1Y2M3YWEwZTg5NmE4MjIzMzVkYTNlNzdiOTc1ZDczMjcy?x=x-p1004982374068-1002812127362-1015264087332>>>SLACK|||WirvsVirus>>>https://wirvsvirushackathon.org>>>WEBSITE|||WirvsVirus>>>https://twitter.com/WirvsVirusHack>>>TWITTER
Nerds Helfen;Germany;DE;Mit diesem Pad sammeln wir IT-Projekte im Zusammenhang mit der Prävention, Heilung und Aufklärung zum Corona-Virus.;technology|||medical|||help|||collaboration;Nerds Helfen>>>https://hackmd.okfn.de/nerds-helfen?view#>>>WEBSITE
g0vhk Hackathon;Hong Kong;HK;g0vhk Hackathon is a half-day event. Participants from different backgrounds brought their laptops to express their problems they found and wanted to solve within three minutes. After the presentation, they met and met with the participants present and teamed up to solve the problem, and released the results of the operation for several hours before the end of Hackathon. Take mass outsourcing to organize data as an example, first you must define the source and purpose of the data, and then you manually enter the data into an online system (such as Google Spreadsheet), then check the correctness of the input data, and finally post the data to the Internet. Visualize the data. Through g0vhk Hackathon, Activism, Issue Based, and Citizenship can be encouraged.;help|||initiative|||idea|||hackathon|||technology;g0vhk Hackathon>>>https://t.me/g0vhk>>>TELEGRAM|||g0vhk Hackathon>>>https://g0vhk.io/>>>WEBSITE|||g0vhk Hackathon>>>https://www.facebook.com/groups/g0vhk/>>>FACEBOOK|||g0vhk Hackathon>>>https://trello.com/b/t5Q99FeA/station-%E5%A4%AA%E7%A9%BA%E7%AB%99>>>TRELLO
COVID 19 Solution Challenge;India;IN;Government of India is taking all necessary steps to ensure that we are prepared well to face the challenge and threat posed by the growing pandemic of COVID 19 – the Corona Virus. With active support of the people of India, we have been able to contain the spread of the Virus in our country. The most important factor in preventing the spread of the Virus locally is to empower the citizens with the right information and taking precautions as per the advisories being issued by Ministry of Health & Family Welfare. Further, we are also getting inputs with regard to individuals and companies who have developed technologies and innovative solutions, Bioinformatics, datasets, Apps for diagnosis etc that can be leveraged for strengthening the fight against Corona. In order to involve the community in the fight against the Virus, we would want you to share your solutions to help fight #Coronavirus. Submitted solutions will be evaluated for adoption and those selected will be suitable rewarded.Be a part of the mission against Coronavirus!;information|||help|||solution;COVID 19 Solution Challenge>>>https://innovate.mygov.in/covid19/>>>WEBSITE
Ecosystem Survival Team - COVID19;Italy;IT;For all the European ecosystem builders (incubators, accelerators, networks, communities, ventures…) and others that are interested in the survival of the entire ecosystem. Started by the non-profit Startup Heatmap Europe.;ecosystem|||help|||start up;Ecosystem Survival Team - COVID19>>>https://ecosystemsurvivalteam.slack.com/join/shared_invite/zt-csl4w278-YB7r~DJl_GLUhTEEw1Tjjg>>>SLACK
HackForce;Latvia;LV;Join the #HackForce - a virtual hackathon to solve one of the biggest problems we face in our time. Europe currently fights serious and sudden challenges due to the current coronavirus crisis, which has created various issues. And emergency situations need an emergency response! We invite everyone, not just developers, but experts, entrepreneurs and professionals in every field to contribute their time and skills to tackle the crisis together.;hackathon|||collaboration|||innovation;HackForce>>>https://ej.uz/hackforce -> https://hackforceworkspace.slack.com/join/shared_invite/zt-cmjsieqa-ubqEJ8bgEeuN9GaWI4jcjQ>>>SLACK|||HackForce>>>https://startuplatvia.eu/event/hackforce>>>WEBSITE
Hack the Crisis;Lithuania;LT;Inspired by our friends from Estonia & the community of Garage48 “HACK THE CRISIS” is a virtual hackathon organised by volunteers from the Lithuanian government, corporates & startup community.No matter your profession, we invite you to join us – we need help from experts in all fields, entrepreneurs and professionals. Please contribute your time and skills & let’s solve the crisis all together.;collaboration|||help|||solution;Hack the Crisis>>>https://hack-the-crisis.slack.com/join/shared_invite/zt-cnrya8c1-pQiVygWQhJMM4_uiz3Ve4g>>>SLACK|||Hack the Crisis>>>https://hackthecrisis.lt/>>>WEBSITE
Codeando México;Mexico;MX;We started activities, where we joined VerificadoCOVID-19 and frenalacurva.net.Today we will be working on one of the two platforms that seeks to centralize VERIFIED information regarding COVID-19. The platform is based on Discourse.org and we have a fork in our GitHub org that we will start working on. The ideal is for today's late-night to have a running version of our own Discourse.;platform|||solution|||information;Codeando Mexico>>>http://slack.codeandomexico.org/>>>SLACK|||Codeando Mexico>>>https://mx.frenalacurva.net/>>>WEBSITE|||Codeando Mexico>>>https://twitter.com/frenalacurvamx/>>>TWITTER|||Codeando Mexico>>>https://www.instagram.com/frenalacurvamx/>>>INSTAGRAM|||Codeando Mexico>>>https://www.facebook.com/frenalacurvamx/>>>FACEBOOK
c19md;Moldova;MD;Join our community and let’s find solutions together for informing, preventing and improving the situation caused by COVID-19, with the help of the modern technology available to us today!;solution|||collaboration|||technology;c19md>>>https://join.slack.com/t/c19md/shared_invite/zt-crwaj52o-t7WS8QBy2cM78eYd4fEhxw>>>SLACK|||c19md>>>https://c19.md/about>>>WEBSITE|||c19md>>>https://www.facebook.com/events/550313822279174/>>>FACEBOOK|||c19md>>>https://trello.com/b/5brSlBON/c19md-projects>>>TRELLO
Code for NL;Netherlands;NL;Join our Slack group, channel #Corona viaalkingmee.codefor.nl These are currently the main activities of people in our network: Translation of StayTheFuckHome.com in Dutch. Auto tweets around corona initiatives via @codefornl Encourage Dutch initiatives to collaborate more, including through our Slack channel. Update and promote coronavirustechhandbook.com. Continued development of a Dutch Corona map. Make contact with international initiatives, including the Code for All network (an umbrella network of organizations comparable to Code for NL). Making foreign civil tech initiatives suitable for the Dutch situation. Overview of Dutch initiatives.;collaboration|||technology|||initiative;Code for NL>>>https://praatmee.codefor.nl/>>>SLACK|||Code for NL>>>https://www.codefor.nl/corona/>>>WEBSITE
Hack Corona;Netherlands;NL;Welcome to the online environment for Hack Corona! The problems that have already been reported can be found on our Sparkboard: https://hackcorona.sparkboard.com/ There you will find a detailed description of the problems. Below are links to the team rooms for the different problems so that you can work with a team on one problem. You can sign up for this by clicking on the link. The numbers refer to the corresponding numbers on Sparkboard. #4 Check corona complaints at home #7 Mask shortage #8 Ventilator shortage # 9 Group Training #10 Beautiful end of life #11 Contaminated surfaces #12 Information needs through different channels #13 Prepare #14 Test Hands-Free Patients #15 Corona Science HUB #16 So don't hoard… #17 Human centered business / licensing models for vaccines / medications #22 Relieve caregivers by using main camera #24 Healthy lifestyle for people at hom e#26 Protect Healthcare Providers #28 Awareness and insight virus transfer #29 Data Driven Trace-Back in Early Epidemic #31 Efficient triage process at hospital entrance;information|||help|||solution;Hack Corona>>>https://twitter.com/HackingHealthNL>>>TWITTER
2019-nCoV-hackathon;Poland;PL;Hi! We can't meet, but we can work together! We organize Hackathon online, which combines ideas and technological solutions that can help in the fight against coronavirus and mitigate the effects of a pandemic.Everyone can join! Not only programmers and people related to IT - we invite doctors, graphic designers, marketers, PR specialists, social activists, local government officials - all who want to work constructively! Join now - #hackthevirus Hackathon is a type of competition for programmers in which participants solve a specific problem (for example, create the right program) in a short time - usually over the weekend. Our hackathon is a bit different - we don't compete, we only cooperate, and we are open to everyone - not just programmers!;hackathon|||technology|||help|||collaboration;2019-nCoV-hackathon>>>https://2019-ncov-hackathon.slack.com/join/shared_invite/zt-ckubrfcx-PeBk8OgQuhE7ihNP8omQCg>>>SLACK|||2019-nCoV-hackathon>>>https://www.facebook.com/groups/hackthevirus/>>>FACEBOOK
HackCrisis;Poland;PL;Join the first edition of the online HackCrisis hackathon. We invite everyone to collaborate on the execution of anticrisis ideas to help people handle the pandemic aftermath. We defined three main areas that might be challenging: isolation, facts & data and education.;isolation|||facts|||data|||education;HackCrisis>>>https://hackcrisis.slack.com/join/shared_invite/zt-clrbb98y-ez_DNEEDMquKyQ6P_1RgMg>>>SLACK|||HackCrisis>>>https://www.hackcrisis.com/>>>WEBSITE|||HackCrisis>>>https://www.facebook.com/hackcrisis/>>>FACEBOOK|||HackCrisis>>>https://twitter.com/HackCrisis>>>TWITTER
HelpfilEngineering;Portugal;PT;COVID-19 is a devastating disease with enormous speed and power. Based on nothing more than its nature, this virus seems intent on reaching every country in the world. Based on nothing more than human goodwill, we've responded with an international effort. We've created Helpful Engineering, a 5,000 strong volunteer organization, with engineers, scientists and doctors around the world. The Helpful Engineering Community is developing simple and effective open-source products and designs to fight COVID-19. These include hardware devices suitable for consumer production and mass manufacturing, as well as important and pragmatic software products and systems. We will continue the search for these projects in subsequent rounds—please continue your important work developing them. We are reviewing the first round of project proposal submissions. We received 24 proposals that have passed an initial quality screen. Both public feedback, and an expert review with administrative involvement, will be used to determine the outcomes. We will provide a detailed report for proposals that make the final selection.;open source|||medical|||health|||engineering;HelpfulEngineering>>>https://helpfulengineering.slack.com/join/shared_invite/zt-cuftcntg-BDc~3oBJ7izijjdmZ6CxZg>>>SLACK|||HelpfulEngineering>>>https://www.projectopenair.org/>>>WEBSITE
HackDay;Romania;RO;COVID-19 is a real threat that must be dealt with with the greatest responsibility. We intend to develop vital technical solutions in order to mitigate the effects of the emergency situation caused by COVID-19 and we need your help! Join a completely online Hack Day edition of Code for Romania!You also participate in the change! It is a time when the calm and determination that this community has shown so far are even more important. Join the effort to stop the spread of COVID-19, choosing one of the new projects and working on them from the comfort of your home.;technology|||solution|||collaboration;HackDay>>>https://tfsg.code4.ro/ro/hackday/>>>WEBSITE|||HackDay>>>https://www.facebook.com/events/211521076874858/>>>FACEBOOK
CoronaVirusMakers;Spain;ES;"Sign up to volunteer here (https://t.me/coronavirus_makers) so we can keep track of who has what skills and direct resources later. In that Telegram group you will find a Google Doc to register. Give us a short ""hello"" and mention your relevant skill set, available tools and look for them in additional groups where you can contribute. If you are a medical professional, contact the organizers. We are seeking input from medical professionals on the best target response areas. Share this form with medical professionals you know.";collaboration|||skill|||help|||technology;CoronaVirusMakers>>>https://t.me/coronavirus_makers>>>TELEGRAM|||CoronaVirusMakers>>>https://www.coronavirusmakers.org/>>>WEBSITE
Oxygen Protofy;Spain;ES;OxyGEN is an open hardware project to build an emergency mechanism that automates an AMBU type manual ventilator in extreme shortage situations such as the one caused by coronavirus (COVID-19) in some parts of the world.;medical|||technology|||ventilator;Oxygen Protofy>>>https://discord.gg/KvRrupY>>>DISCORD|||Oygen Protofy>>>https://oxygen.protofy.xyz/>>>WEBSITE|||Oxygen Protofy>>>https://www.facebook.com/frenalacurva/>>>FACEBOOK|||Oxygen Protofy>>>https://twitter.com/frenalacurva>>>TWITTER
