Pandemi Hack;Sweden;SE;The project started on 2020-03-17 as a collaboration between Region Östergötland and Makerspace Linköping, see https://makerslink.se/pandemihack/ Now we are expanding the project to the whole nation through the cooperation organization Makers of Sweden, which has recently set up this forum. We also extend it to those parts of the population that have not yet found their way into the maker movement and any of the makerspace in the country. We will in the near future move over the info and discussions here. Sub-project 1: Back-up solutions for respiratory and eye / face protection.;collaboration|||solution|||medical|||health;Pandemi hack>>>https://forum.makersofsweden.se/>>>WEBSITE|||Pandemi Hack>>>https://makerspace-linkoping.slack.com/>>>SLACK
g0v.tw;Taiwan;TW;g0v.tw is an online community that pushes information transparency, focusing on developing information platform and tools for the citizens to participate in society. Substituting the “o” with “0? in gov, the new “g0v” not only stands for rethinking the role that the government plays from the bottom up, but also represents the world view of 0 and 1 in the digital natives generation. Based on the spirit of open source, g0v cares about freedom of speech and open data, writing code to provide citizens the easy-to-use information service. The transparency of information can help citizens to have a better understanding on how the government works, to understand the issues faster and to avoid media monopoly, so they can monitor the government more efficiently, and become involved in actions and finally deepen the quality of democracy.;open source|||information|||collaboration;g0v.tw>>>http://join.g0v.tw/>>>SLACK|||g0v.tw>>>https://g0v.tw/>>>WEBSITE|||g0tv.tw>>>https://www.facebook.com/groups/g0v.general/>>>FACEBOOK
Dev for Tunisia;Tunisia;TN;Crowd-Based Tech & Digital innovationg group working towards socially responsible project ideas to fight the pandamic (and probably general national issues in the future) along with the government. The group also works to connect those who want to volunteer in the above fields with initiatives looking for human resources.;Technology|||digital|||collaboration|||help|||volunteer;Dev for Tunisia>>>https://www.facebook.com/groups/DevForTunisia/>>>FACEBOOK
Makers against Corona;Tunisia;TN;“Makers against Corona”. Open source medical supplies that could be easily done and used by anyone.;medical|||supply|||technology;Makers against Corona>>>https://join.slack.com/t/coronamaker/shared_invite/zt-ctbtpn2t-bLv4U7PUeLIkr9bZQGj9fg>>>SLACK
"Yes We Breathe ""ENISo"" & ""FMS""";Tunisia;TN;Yes WE Breathe;medical|||technology|||ventilator;"Yes We Breathe ""ENISo"" & ""FMS"">>>https://www.facebook.com/groups/197977924766891/>>>FACEBOOK|||Yes We Breathe ""ENISo"" & ""FMS"">>>https://www.facebook.com/groups/211124023294336>>>FACEBOOK"
Covid Emergency Response;United Kingdom;GB;Welcome to Covid Emergency Response - a community of tech people available to work on products solving the direct and indirect impacts of Covid-19.;technology|||medical|||help|||collaboration;Covid Emergency Response>>>https://join.slack.com/t/corona-emergency/shared_invite/zt-cms2o7rm-FtmF~455wnm6ce108Gqggg>>>SLACK|||Covid Emergency Response>>>https://covidmutualaid.org/>>>WEBSITE|||Covid Emergency Response>>>https://www.facebook.com/CovidAidUK/>>>FACEBOOK
Hack Quarantine;United Kingdom;GB;A fully-online, people-focused hackathon bringing people together to use their skills to help combat the issues the world is facing with the COVID-19 pandemic. By working with medical professionals and industry, we’ll provide the knowledge and tools to empower hackers to work towards around improving health, remote working and helping vulnerable populations.;knowledge|||collaboration|||help|||technology|||medical;Hack Quarantine>>>https://discord.hackquarantine.com/>>>DISCORD|||Hack Quarantine>>>https://hackquarantine.com/>>>WEBSITE|||Hack Quarantine>>>https://twitter.com/HackQuarantine>>>TWITTER|||Hack Quarantine>>>https://www.facebook.com/HackQuarantine>>>FACEBOOK|||Hack Quarantine>>>https://www.instagram.com/hackquarantine/>>>INSTAGRAM
Fix the Crisis;Ukraine;UA;The world is grappling with the serious challenges caused by the coronavirus. Cities and countries pause. For those who do not want to pack on Mars, we suggest to rally and fix the situation! We urge all those who are indifferent to join in generating and discussing ideas that will help the country recover. The best solutions will be appreciated by company executives, spread the media, be able to embody your neighbors and anyone, and the winners will receive 20,000 Ukrainian Hryvnia (UAH) from our Genesis partners.;ideas|||neighbor|||neighborhood|||help;Fix the Crisis>>>https://t.me/fixthecrisis>>>TELEGRAM|||Fix the Crisis>>>https://casers.org/cases/fix-the-crisis>>>WEBSITE|||Fix the Crisis>>>https://www.facebook.com/events/231015604720156/>>>FACEBOOK
StopCovid UA;Ukraine;UA;Welcome to chat #StopCovidUA We are a voluntary team of volunteers who work to reduce the spread of the virus and increase informed behavior among citizens. Information for volunteers.;medical|||help|||spread;StopCovid UA>>>https://stopcovid.org.ua/>>>WEBSITE|||StopCovid UA>>>https://t.me/stopcovidua>>>TELEGRAM|||StopCovid UA>>>https://www.instagram.com/stopcovidua/>>>INSTAGRAM|||StopCovid UA>>>https://discord.gg/Vymmzta>>>DISCORD
1 Million Ventilators;United States of America;US;We need to develop a strategic reserve of 1,000,000+ emergency ventilators ASAP. These don't need to be fancy medical ventilators, they just need to work.In a pandemic, the limited existing ventilator supply and stockpile should be reserved for treating the most critical life-threatening cases.We need to create an emergency ventilator that can be used for millions of minor cases, including patients who require long-term (15-30 day) ventilation on recovery.;medical|||technology|||ventilator|||collaboration;1 Million Ventilators>>>https://discord.gg/HUS7VW>>>DISCORD|||1 Million Ventilators>>>https://helpwithcovid.com/projects/13-1-million-ventilators>>>WEBSITE
CoronaHub;United States of America;US;Coronahub is an online community dedicated to confronting the massive worldwide burden caused by the Coronavirus. The community’s job board connects healthcare workers and volunteers with medical providers, while its Slack chat channel allows for the general public to share Coronavirus news and exchange safety advice.;healthcare|||medical|||collaboration|||volunteer;CoronaHub>>>https://join.slack.com/t/coronahub/shared_invite/zt-cry7wk1h-GIM~xUJCXLHJ17DUgZ3zkw>>>SLACK|||CoronaHub>>>https://coronahub.co/>>>WEBSITE
MutualAidNational;United States of America;US;Welcome to the COVID-19 Mutual Aid Coordination Slack.  recent weeks, new mutual aid networks have sprung up around the country. Other older networks have been re-activated, and still more have been around for a long time and never stopped being active. We haven’t seen any mechanism for these networks to communicate directly with one another, so we decided to build one. We know that we have a lot to learn from each other. Our goal is to bring our diverse networks into more effective coordination, for the duration of this crisis and beyond.The hope is that this workspace can be used to share resources, tools, and best practices, to resource, scale, and replicate mutual aid, and to otherwise communicate.;network|||collaboration|||technology|||help|||coordination;MutualAidNational>>>https://join.slack.com/t/mutualaidnational/shared_invite/zt-cs6npzra-1~A9RFuKusoN_cb~Bqy8Gg>>>SLACK
NECSI;United States of America;US;EndCoronavirus.org (NECSI). endCoronavirus.org is an action network of @NECSI, scientists @Harvard@MITand volunteers. We educate in order to end the outbreak of Coronavirus COVID-19. A group of the New England Complex Systems Institute (NECSI).;science|||medical|||collaboration|||university;NECSI>>>https://necsi-edu.slack.com/join/shared_invite/zt-cu5215sg-63h4A7uCy~ehDsrfAIJ~_Q>>>SLACK|||NECSI>>>https://www.endcoronavirus.org/>>>WEBSITE|||NECSI>>>https://twitter.com/endCOVID19>>>TWITTER
